{
  "graphIdentityVersion": "sourcegraph-identity/v2",
  "graphSchemaVersion": "acp6-sourcegraph/v1",
  "relationIdentityVersion": "relation-id/v1",
  "sourceDigest": "0000000000000000000000000000000000000000000000000000000000000000",
  "nodes": [
    {"id": "node:a", "kind": "token-use", "label": "var(--x)"},
    {"id": "node:b", "kind": "token", "label": "--x"}
  ],
  "edges": [
    {"id": "rel:a", "from": "node:a", "to": "node:b", "kind": "reads", "certainty": "semantic-candidate", "evidenceRefs": [], "sourceUse": {"path": "src/a.css", "charOffset": 4, "byteOffset": 4, "offsetUnit": "code-unit"}},
    {"id": "rel:a", "from": "node:a", "to": "node:b", "kind": "reads", "certainty": "semantic-candidate", "evidenceRefs": [], "sourceUse": {"path": "src/a.css", "charOffset": 8, "byteOffset": 8, "offsetUnit": "code-unit"}}
  ],
  "unresolved": []
}
