{
  "unresolved": [],
  "edges": [
    {"sourceUse": {"offsetUnit": "code-unit", "byteOffset": 4, "charOffset": 4, "path": "src/a.css"}, "evidenceRefs": ["e1", "e2"], "certainty": "source-proven", "kind": "reads", "to": "node:b", "from": "node:a", "id": "rel:a"}
  ],
  "nodes": [
    {"label": "var(--x)", "kind": "token-use", "id": "node:a", "location": {"byteOffset": 4, "offset": 4, "path": "src/a.css"}},
    {"label": "--x", "kind": "token", "id": "node:b"}
  ],
  "relationIdentityVersion": "relation-id/v1",
  "graphSchemaVersion": "acp6-sourcegraph/v1",
  "graphIdentityVersion": "sourcegraph-identity/v2",
  "sourceDigest": "0000000000000000000000000000000000000000000000000000000000000000"
}
