{
  "graphIdentityVersion": "sourcegraph-identity/v2",
  "graphSchemaVersion": "acp6-sourcegraph/v1",
  "relationIdentityVersion": "relation-id/v1",
  "sourceDigest": "0000000000000000000000000000000000000000000000000000000000000000",
  "nodes": [
    {"id": "节点:é", "kind": "token", "label": "é"},
    {"id": "节点:é", "kind": "token-use", "label": "é"}
  ],
  "edges": [
    {"id": "rel:é", "from": "节点:é", "to": "节点:é", "kind": "reads", "certainty": "source-proven", "evidenceRefs": ["证据:é", "证据:é"], "sourceUse": {"path": "src/é.css", "charOffset": 1, "byteOffset": 2, "offsetUnit": "code-unit"}}
  ],
  "unresolved": ["未解析:é", "未解析:é"]
}
