{
  "graphIdentityVersion": "sourcegraph-identity/v2",
  "graphSchemaVersion": "acp6-sourcegraph/v1",
  "relationIdentityVersion": "relation-id/v1",
  "sourceDigest": "0000000000000000000000000000000000000000000000000000000000000000",
  "nodes": [
    {"id": "node:b", "kind": "token", "label": "--x"},
    {"id": "node:a", "kind": "token-use", "label": "var(--x)", "location": {"path": "src/a.css", "offset": 4, "byteOffset": 4}}
  ],
  "edges": [
    {"id": "rel:a", "from": "node:a", "to": "node:b", "kind": "reads", "certainty": "source-proven", "evidenceRefs": ["e1", "e2"], "sourceUse": {"path": "src/a.css", "charOffset": 4, "byteOffset": 5, "offsetUnit": "code-unit"}}
  ],
  "unresolved": []
}
